{
  "catalog_digest": "9873d59efb06a4b720ae6e9753107d67f2f5b644db97a13fc61f47dc48735e73",
  "classification_errors": 0,
  "excluded_target_ids": [],
  "format": "buildhunter.rule-profile/1",
  "preliminary_calls": 153,
  "resolved_calls": 103,
  "rules": [
    {
      "average_ns": 232,
      "evaluations": 51,
      "false": 0,
      "max_ns": 1042,
      "package_id": "local.template.af4138ce-5fae-4195-98cb-c4ecd14eb770",
      "phase": "preliminary",
      "rule_id": "output",
      "skipped_by_dispatch": 102,
      "target_id": "local.template.af4138ce-5fae-4195-98cb-c4ecd14eb770-output",
      "total_ns": 11832,
      "true": 0,
      "unknown": 51
    },
    {
      "average_ns": 80.84313725490196,
      "evaluations": 51,
      "false": 1,
      "max_ns": 208,
      "package_id": "local.template.af4138ce-5fae-4195-98cb-c4ecd14eb770",
      "phase": "resolved",
      "rule_id": "output",
      "skipped_by_dispatch": 52,
      "target_id": "local.template.af4138ce-5fae-4195-98cb-c4ecd14eb770-output",
      "total_ns": 4123,
      "true": 50,
      "unknown": 0
    },
    {
      "average_ns": null,
      "evaluations": 0,
      "false": 0,
      "max_ns": 0,
      "package_id": "org.buildhunter.python",
      "phase": "preliminary",
      "rule_id": "python-bytecode",
      "skipped_by_dispatch": 153,
      "target_id": "python.bytecode",
      "total_ns": 0,
      "true": 0,
      "unknown": 0
    },
    {
      "average_ns": null,
      "evaluations": 0,
      "false": 0,
      "max_ns": 0,
      "package_id": "org.buildhunter.python",
      "phase": "resolved",
      "rule_id": "python-bytecode",
      "skipped_by_dispatch": 103,
      "target_id": "python.bytecode",
      "total_ns": 0,
      "true": 0,
      "unknown": 0
    },
    {
      "average_ns": null,
      "evaluations": 0,
      "false": 0,
      "max_ns": 0,
      "package_id": "org.buildhunter.python",
      "phase": "preliminary",
      "rule_id": "python-pytest-cache",
      "skipped_by_dispatch": 153,
      "target_id": "python.pytest-cache",
      "total_ns": 0,
      "true": 0,
      "unknown": 0
    },
    {
      "average_ns": null,
      "evaluations": 0,
      "false": 0,
      "max_ns": 0,
      "package_id": "org.buildhunter.python",
      "phase": "resolved",
      "rule_id": "python-pytest-cache",
      "skipped_by_dispatch": 103,
      "target_id": "python.pytest-cache",
      "total_ns": 0,
      "true": 0,
      "unknown": 0
    },
    {
      "average_ns": null,
      "evaluations": 0,
      "false": 0,
      "max_ns": 0,
      "package_id": "org.buildhunter.python",
      "phase": "preliminary",
      "rule_id": "python-mypy-cache",
      "skipped_by_dispatch": 153,
      "target_id": "python.mypy-cache",
      "total_ns": 0,
      "true": 0,
      "unknown": 0
    },
    {
      "average_ns": null,
      "evaluations": 0,
      "false": 0,
      "max_ns": 0,
      "package_id": "org.buildhunter.python",
      "phase": "resolved",
      "rule_id": "python-mypy-cache",
      "skipped_by_dispatch": 103,
      "target_id": "python.mypy-cache",
      "total_ns": 0,
      "true": 0,
      "unknown": 0
    },
    {
      "average_ns": null,
      "evaluations": 0,
      "false": 0,
      "max_ns": 0,
      "package_id": "org.buildhunter.python",
      "phase": "preliminary",
      "rule_id": "python-ruff-cache",
      "skipped_by_dispatch": 153,
      "target_id": "python.ruff-cache",
      "total_ns": 0,
      "true": 0,
      "unknown": 0
    },
    {
      "average_ns": null,
      "evaluations": 0,
      "false": 0,
      "max_ns": 0,
      "package_id": "org.buildhunter.python",
      "phase": "resolved",
      "rule_id": "python-ruff-cache",
      "skipped_by_dispatch": 103,
      "target_id": "python.ruff-cache",
      "total_ns": 0,
      "true": 0,
      "unknown": 0
    },
    {
      "average_ns": null,
      "evaluations": 0,
      "false": 0,
      "max_ns": 0,
      "package_id": "org.buildhunter.python",
      "phase": "preliminary",
      "rule_id": "python-pytype-cache",
      "skipped_by_dispatch": 153,
      "target_id": "python.pytype-cache",
      "total_ns": 0,
      "true": 0,
      "unknown": 0
    },
    {
      "average_ns": null,
      "evaluations": 0,
      "false": 0,
      "max_ns": 0,
      "package_id": "org.buildhunter.python",
      "phase": "resolved",
      "rule_id": "python-pytype-cache",
      "skipped_by_dispatch": 103,
      "target_id": "python.pytype-cache",
      "total_ns": 0,
      "true": 0,
      "unknown": 0
    },
    {
      "average_ns": null,
      "evaluations": 0,
      "false": 0,
      "max_ns": 0,
      "package_id": "org.buildhunter.python",
      "phase": "preliminary",
      "rule_id": "python-tox",
      "skipped_by_dispatch": 153,
      "target_id": "python.tox",
      "total_ns": 0,
      "true": 0,
      "unknown": 0
    },
    {
      "average_ns": null,
      "evaluations": 0,
      "false": 0,
      "max_ns": 0,
      "package_id": "org.buildhunter.python",
      "phase": "resolved",
      "rule_id": "python-tox",
      "skipped_by_dispatch": 103,
      "target_id": "python.tox",
      "total_ns": 0,
      "true": 0,
      "unknown": 0
    },
    {
      "average_ns": null,
      "evaluations": 0,
      "false": 0,
      "max_ns": 0,
      "package_id": "org.buildhunter.python",
      "phase": "preliminary",
      "rule_id": "python-nox",
      "skipped_by_dispatch": 153,
      "target_id": "python.nox",
      "total_ns": 0,
      "true": 0,
      "unknown": 0
    },
    {
      "average_ns": null,
      "evaluations": 0,
      "false": 0,
      "max_ns": 0,
      "package_id": "org.buildhunter.python",
      "phase": "resolved",
      "rule_id": "python-nox",
      "skipped_by_dispatch": 103,
      "target_id": "python.nox",
      "total_ns": 0,
      "true": 0,
      "unknown": 0
    },
    {
      "average_ns": null,
      "evaluations": 0,
      "false": 0,
      "max_ns": 0,
      "package_id": "org.buildhunter.python",
      "phase": "preliminary",
      "rule_id": "python-build",
      "skipped_by_dispatch": 153,
      "target_id": "python.build",
      "total_ns": 0,
      "true": 0,
      "unknown": 0
    },
    {
      "average_ns": null,
      "evaluations": 0,
      "false": 0,
      "max_ns": 0,
      "package_id": "org.buildhunter.python",
      "phase": "resolved",
      "rule_id": "python-build",
      "skipped_by_dispatch": 103,
      "target_id": "python.build",
      "total_ns": 0,
      "true": 0,
      "unknown": 0
    },
    {
      "average_ns": null,
      "evaluations": 0,
      "false": 0,
      "max_ns": 0,
      "package_id": "org.buildhunter.python",
      "phase": "preliminary",
      "rule_id": "python-dist",
      "skipped_by_dispatch": 153,
      "target_id": "python.dist",
      "total_ns": 0,
      "true": 0,
      "unknown": 0
    },
    {
      "average_ns": null,
      "evaluations": 0,
      "false": 0,
      "max_ns": 0,
      "package_id": "org.buildhunter.python",
      "phase": "resolved",
      "rule_id": "python-dist",
      "skipped_by_dispatch": 103,
      "target_id": "python.dist",
      "total_ns": 0,
      "true": 0,
      "unknown": 0
    },
    {
      "average_ns": null,
      "evaluations": 0,
      "false": 0,
      "max_ns": 0,
      "package_id": "org.buildhunter.python",
      "phase": "preliminary",
      "rule_id": "python-egg-info",
      "skipped_by_dispatch": 153,
      "target_id": "python.egg-info",
      "total_ns": 0,
      "true": 0,
      "unknown": 0
    },
    {
      "average_ns": null,
      "evaluations": 0,
      "false": 0,
      "max_ns": 0,
      "package_id": "org.buildhunter.python",
      "phase": "resolved",
      "rule_id": "python-egg-info",
      "skipped_by_dispatch": 103,
      "target_id": "python.egg-info",
      "total_ns": 0,
      "true": 0,
      "unknown": 0
    },
    {
      "average_ns": 173.26797385620915,
      "evaluations": 153,
      "false": 50,
      "max_ns": 2583,
      "package_id": "org.buildhunter.python",
      "phase": "preliminary",
      "rule_id": "python-environment",
      "skipped_by_dispatch": 0,
      "target_id": "python.environment",
      "total_ns": 26510,
      "true": 0,
      "unknown": 103
    },
    {
      "average_ns": 79.71844660194175,
      "evaluations": 103,
      "false": 103,
      "max_ns": 250,
      "package_id": "org.buildhunter.python",
      "phase": "resolved",
      "rule_id": "python-environment",
      "skipped_by_dispatch": 0,
      "target_id": "python.environment",
      "total_ns": 8211,
      "true": 0,
      "unknown": 0
    },
    {
      "average_ns": null,
      "evaluations": 0,
      "false": 0,
      "max_ns": 0,
      "package_id": "org.buildhunter.rust",
      "phase": "preliminary",
      "rule_id": "rust-target",
      "skipped_by_dispatch": 153,
      "target_id": "rust.target",
      "total_ns": 0,
      "true": 0,
      "unknown": 0
    },
    {
      "average_ns": null,
      "evaluations": 0,
      "false": 0,
      "max_ns": 0,
      "package_id": "org.buildhunter.rust",
      "phase": "resolved",
      "rule_id": "rust-target",
      "skipped_by_dispatch": 103,
      "target_id": "rust.target",
      "total_ns": 0,
      "true": 0,
      "unknown": 0
    },
    {
      "average_ns": null,
      "evaluations": 0,
      "false": 0,
      "max_ns": 0,
      "package_id": "org.buildhunter.swift",
      "phase": "preliminary",
      "rule_id": "swift-build",
      "skipped_by_dispatch": 153,
      "target_id": "swift.build",
      "total_ns": 0,
      "true": 0,
      "unknown": 0
    },
    {
      "average_ns": null,
      "evaluations": 0,
      "false": 0,
      "max_ns": 0,
      "package_id": "org.buildhunter.swift",
      "phase": "resolved",
      "rule_id": "swift-build",
      "skipped_by_dispatch": 103,
      "target_id": "swift.build",
      "total_ns": 0,
      "true": 0,
      "unknown": 0
    }
  ],
  "scan_status": "completed",